id,competitor,country,title,description,bonus_amount,bonus_type,conditions,wagering,valid_until,url,scraped_at,hash_id,created_at
1450,Bwin,DE,Found 'bonus' on page,bonus | bwin registrieren einloggen jetzt deine 1. einzahlung verdoppeln - bis zu 100€. registrieren registrieren 18+. suchtrisiko. buwei.de. offiziel,Up to €100,Welcome Bonus,"First deposit doubled, must register and log in",,,https://www.bwin.de/de/engage/lan/sports/dach/generic?wm=5193158&tdpeh=19560_14049767752_130930494691_665955561599_kwd-2846598995_e_c&utm_source=search_google&utm_campaign=14049767752&utm_content=665955561599&utm_medium=e&utm_term=bwin&sb=1&gad_source=1&gad_campaignid=14049767752&gbraid=0AAAAADxF3XuZHpUf_fu-oNGcirsf3dpgA&gclid=CjwKCAjw0sfHBhB6EiwAQtv5qQgvjFW3OR0Y-WToB54P8KFiwr3cA_CbOplYPv_R5gRYFXk1eKb20xoCRO0QAvD_BwE,2025-10-17T12:01:27.863592,7155942275341088856,2025-10-17 10:08:28
1448,Lowen Play,DE,Found 'free spins' on page,"free spins bei einem bonus ohne einzahlung, cash back oder gratis free spins gilt: die maximale gewinnauszahlung beträgt 100€.",Not specified,Free Spins,No deposit required. Maximum win payout is €100.,,,https://www.loewen-play.de/bonus,2025-10-17T12:03:38.675914,8204692248177721241,2025-10-17 10:08:28
1449,Lowen Play,DE,Found promotion on page,"Löwen Play offers various bonuses: free spins, no deposit bonus, deposit bonus",,Other,"Various bonuses including free spins, no deposit bonus, and deposit bonus",,,https://www.loewen-play.de/bonus,2025-10-17T12:03:38.675914,-2849866756604847443,2025-10-17 10:08:28
1451,NV Casino,DE,Found 'bonus' on page,"Register now and get up to €2,000 bonus + 225 free spins. Includes tournaments, sports, VIP club, leaderboard, and bonus wheel.",€2000 + 225 free spins,Welcome Bonus,Registration required. Includes multiple promotional features like tournaments and a VIP club.,,,https://nv.casino/de,2025-10-17T11:55:37.171330,-6090434452014429401,2025-10-17 10:08:28
1454,Wunderino,DE,Found 'jackpot' on page,"jackpot schon bald dir! erfahrung über 1000 beliebte & lokale spiele jede woche neue kampagnen verfügbar auf smartphone, tablet, mac und pc sicherheit",,Jackpot,"Experience over 1000 popular & local games, new campaigns available every week, available on smartphone, tablet, mac and PC, security",,,https://wunderino.de,2025-10-17T11:18:53.008078,-7025153265224619876,2025-10-17 10:08:28
1453,Wunderino,DE,Found bonus on page,"Bonus + 100 cash-spins worth €10. No wagering conditions. Register now. Bonus terms search here: Book of Dead, Synot Toplisten Auto",100 cash-spins worth €10,Free Spins,No wagering conditions,,,https://www.wunderino.de,2025-10-17T11:18:58.542949,1892529766563896476,2025-10-17 10:08:28
1455,Wunderino,DE,Found bonus on page,"bonus + 100 cash-spins cash-spins: value 10€. No wagering conditions. Register now. Bonus terms search here: book of dead, synot toplisten auto",100 cash spins worth €10,Free Spins,"No wagering conditions, registration required",,,https://wunderino.de,2025-10-17T11:18:53.008078,8781749538520812838,2025-10-17 10:08:28
